{
  "$schema": "/data/data/com.termux/files/home/tools/schemas/tool_definition.json",
  "name": "skill-extractor",
  "description": "Extracts a learning into a reusable skill following Agent Skills spec",
  "version": "1.0.0",
  "category": "ai",
  "entry_point": "/data/data/com.termux/files/home/.openclaw/skills/self-improving-agent/scripts/extract-skill.sh",
  "requires_root": false,
  "parameters": {
    "skill_name": {
      "type": "string",
      "description": "Name of the skill (lowercase, hyphens for spaces)",
      "required": true
    },
    "description": {
      "type": "string",
      "description": "Concise description of what the skill does",
      "required": false
    },
    "learning_id": {
      "type": "string",
      "description": "Original learning ID this skill is extracted from",
      "required": false
    },
    "output_dir": {
      "type": "string",
      "description": "Output directory for the skill (relative path)",
      "required": false,
      "default": "./skills"
    },
    "dry_run": {
      "type": "boolean",
      "description": "Show what would be created without creating files",
      "required": false,
      "default": false
    }
  },
  "returns": {
    "type": "object",
    "description": "Skill path and next steps"
  }
}
